{
  "$schema": "./forbidden-compatibility-surfaces.schema.json",
  "version": 1,
  "clientMethods": [
    "addMemory",
    "admitPrompt",
    "applySessionGoalAction",
    "archiveProject",
    "archiveSession",
    "authLogin",
    "authLogout",
    "cancelJob",
    "cancelQueuedPrompt",
    "capabilities",
    "closeTerminal",
    "compactSession",
    "connectCatalogProvider",
    "createBackgroundShell",
    "createCustomProvider",
    "createScheduledTask",
    "createSession",
    "createSessionGoal",
    "createTerminal",
    "deleteAttachment",
    "deleteSession",
    "disablePlugin",
    "disconnectCatalogProvider",
    "downloadAttachment",
    "editLatestPrompt",
    "enablePlugin",
    "exportSession",
    "forkSession",
    "gcAttachmentStorage",
    "getAttachment",
    "getAuthStatus",
    "getChannelStatus",
    "getContextPreview",
    "getContextStatus",
    "getContextUsage",
    "getGitBranch",
    "getGitDiff",
    "getGitStatus",
    "getMemory",
    "getProfileStatus",
    "getScheduledTask",
    "getScheduledTaskStatus",
    "getSession",
    "getSessionGoal",
    "getSessionMcp",
    "getSessionState",
    "getSessionUsage",
    "getSettings",
    "getTerminal",
    "gitCommit",
    "handleChannelMessage",
    "health",
    "initProfile",
    "initProject",
    "inspectProject",
    "installLocalPlugin",
    "installPluginArchive",
    "installPluginGit",
    "interruptSession",
    "listAgentPersonas",
    "listCommands",
    "listContextPlugins",
    "listEvents",
    "listHooks",
    "listJobs",
    "listMemory",
    "listMessageParts",
    "listMessages",
    "listModels",
    "listOutputStyles",
    "listPendingChannelDeliveries",
    "listPermissions",
    "listPlugins",
    "listProjects",
    "listProviders",
    "listScheduledRuns",
    "listScheduledTasks",
    "listSessions",
    "listSkills",
    "listTerminals",
    "patchSettings",
    "previewPluginArchive",
    "previewPluginGit",
    "promoteQueuedPrompt",
    "readJob",
    "readTerminal",
    "rebindProject",
    "recordChannelDelivery",
    "reloadPlugins",
    "rememberSession",
    "removeCustomProvider",
    "removeMemory",
    "removeScheduledTask",
    "removeSkill",
    "renameProject",
    "repairAttachmentStorage",
    "replyPermission",
    "resizeTerminal",
    "resumeInterruptedRun",
    "rewindSession",
    "scanAttachmentStorage",
    "sendJob",
    "setProjectDefaultShell",
    "setProjectPinned",
    "setScheduledRunUnread",
    "signalTerminal",
    "startDream",
    "streamEvents",
    "streamTerminalEvents",
    "triggerScheduledTask",
    "uninstallPlugin",
    "updateCustomProvider",
    "updateScheduledTask",
    "updateSession",
    "updateSessionGoal",
    "uploadAttachment",
    "waitJob",
    "writeTerminal"
  ],
  "runtimeExports": [
    "baseUrl",
    "fetchImpl",
    "sse",
    "token",
    "transport"
  ],
  "httpRoutes": [],
  "cliCommands": [],
  "cliOptions": [
    "--bare"
  ],
  "environmentVariables": [],
  "configFields": [
    "projectId",
    "sessionId"
  ],
  "enumValues": [],
  "schemaNames": [
    "PluginScope",
    "buildNativePluginCompatibilityEnvironment",
    "isLegacyWindowsPowerShell",
    "legacyShellDescriptor",
    "SessionApplicationService",
    "session-application-service",
    "withSessionOperation"
  ]
}
